2025-11-12,19:13:01,0,LabAssistant,1762974782598,Hi! I'm LabAssistant. Let’s wait until both teammates have joined the discussion.,WELCOME_WAIT
2025-11-12,19:13:07,0,LabAssistant,1762974788620,"Once everyone is ready, we'll tackle four different parts of our experiment in the Virtual Lab. For each part, the goal is to determine the stoichiometry of the reaction that occurs.",WELCOME_CONTEXT
2025-11-12,19:13:22,0,LabAssistant,1762974802629,"Please navigate to the ""Scratchpad"" tab and make sure you are logged in with your Google account in the document. Also review the ""VirtualLab Tutorial"" tab. Reach out to your Professor in case of any questions. After you are ready, each of you type <span style=""color:#d9534f; font-weight:bold;"">ready</span> to begin the experiment.",WELCOME_READY_PROMPT
2025-11-12,19:13:50,0,abc_A,1762974830215,A and C react together.,
2025-11-12,19:24:01,0,abc_A,1762975441908,I think the B and C are the reactants,GIVING_OPINION
2025-11-12,19:24:31,0,abc_B,1762975471241,I got 0.1B + 0.1C = 0.3C + some D,
