2021-01-15,11:11:07,0,JeopardyAgent,1610727069320,Hello! I'm JeopardyAgent. Take a minute to introduce yourselves.,INTRODUCE
2021-01-15,11:11:20,0,Meredith,1610727080323,i'm meredith,GIVING_NAME
2021-01-15,11:11:20,0,JeopardyAgent,1610727081368,"Hello, Meredith!",GREET
2021-01-15,11:11:37,0,JeopardyAgent,1610727097402,"In this game, you will be prompted with a clue that represents an answer. Your job is to give the corresponding question! For example, upon picking a category and point value, you will receive something like this: ""This university is the largest fully-online nonprofit university in the country.""",INSTRUCTIONS
2021-01-15,11:11:37,0,JeopardyAgent,1610727102404,"Then... You will answer with the question! In this case, it should be: ""What is WGU?"", or you may simply type: ""WGU"".",INSTRUCTIONS
2021-01-15,11:12:07,0,JeopardyAgent,1610727131490,Okay! Let's begin. We'll be playing Jeopardy.,GIVE_UP_ON_INTRODUCTIONS
2021-01-15,11:12:18,0,JeopardyAgent,1610727139521,Please pick a category. Format = category + value.,JEOPARDY_CATEGORY
