2021-01-11,11:06:09,0,JeopardyAgent,1610381171041,INTRODUCE_1,INTRODUCE
2021-01-11,11:06:34,0,JeopardyAgent,1610381195125,Okay! We'll be playing Jeopardy.,GIVE_UP_ON_INTRODUCTIONS
2021-01-11,11:06:46,0,JeopardyAgent,1610381207157,Insert instructions here.,INSTRUCTIONS
2021-01-11,11:06:57,0,JeopardyAgent,1610381219197,Please pick a category. Format = category + value.,JEOPARDY_CATEGORY
2021-01-11,11:07:09,0,JeopardyAgent,1610381231240,Okay! We'll be playing Jeopardy.,GIVE_UP_ON_INTRODUCTIONS
2021-01-11,11:07:30,0,JeopardyAgent,1610381251291,Ask me for another category please.,CONTINUE_JEOPARDY_CATEGORIES
