2021-01-21,09:50:30,0,JeopardyAgent,1611240631947," Okay! We are running out of time with this activity... Speaking of which, *time management* is one of the greatest challenges for the average WGU student! Juggling family obligations, work, school, and other life obligations is no small feat! One of the advantages of having a buddy in your courses is the ability to study together, keep each other accountable with work, and offer peer support!
",TIME_MGMT
2021-01-21,09:51:05,0,JeopardyAgent,1611240666089,"If you'd like, please share your email address, social media, or phone number with each other to keep in contact after this activity. Your personal information will not be used in any way outside of this conversation. Thank you for your participation! ",SOCIAL
2021-01-21,09:51:28,0,JeopardyAgent,1611240690184,"For further information about WGU Academy, FAQs, and more, please visit: https://academy.wgu.edu/.",WGU_GOODBYE
2021-01-21,09:51:42,0,JeopardyAgent,1611240702218,Great job! I hope you both enjoyed that as much as I did. Nothing like a little friendly competition! ;-) Did you learn anything new? ,JEOPARDY_OUTRO
2021-01-21,09:52:01,0,JeopardyAgent,1611240722293,"A degree from WGU is one piece of a larger pie that will set you up for success in your career. And like any great bakery, there is a great variety of pies, and no two are exactly the same!",PIE_INTRO
